{
  "id": 2,
  "source": "Web Form",
  "received_at": "2026-10-16T12:57:30.839Z",
  "message": "We'd love to see a bulk export feature for our audit logs. We're a compliance-heavy org and this would save us hours every month.",
  "classification": {
    "rationale": "The message asks for a capability the customer believes does not exist.",
    "category": "Feature Request",
    "priority": "Low",
    "confidence": 0.95
  },
  "enrichment": {
    "core_issue": "The customer requests a bulk export feature for audit logs.",
    "identifiers": [],
    "billing": {
      "invoiced_amount": null,
      "contract_amount": null,
      "currency": null
    },
    "urgency": {
      "evidence": [],
      "level": "Low"
    },
    "multi_user_impact": false,
    "actionable": true
  },
  "routing": {
    "standard_queue": "Product",
    "destination_queue": "Product"
  },
  "summary": "The customer is requesting a bulk export feature for audit logs, stating that it would save their compliance-heavy organization hours every month.",
  "escalation": {
    "flagged": false,
    "reasons": [],
    "billing_discrepancy": null
  },
  "meta": {
    "model": "gpt-4o-mini-2024-07-18",
    "processed_at": "2026-10-16T12:57:32.628Z",
    "error": null
  }
}