{
  "id": 5,
  "source": "Web Form",
  "received_at": "2026-10-16T12:32:50.855Z",
  "message": "Your dashboard stopped loading for us around 2pm EST. Checked our end — it's definitely on yours. Multiple users affected.",
  "classification": {
    "rationale": "The message states that the dashboard stopped loading and multiple users are affected, indicating a service outage.",
    "category": "Incident/Outage",
    "priority": "High",
    "confidence": 0.95
  },
  "enrichment": {
    "core_issue": "The customer reports that their dashboard stopped loading.",
    "identifiers": [],
    "billing": {
      "invoiced_amount": null,
      "contract_amount": null,
      "currency": null
    },
    "urgency": {
      "evidence": [
        "stopped loading for us around 2pm EST",
        "it's definitely on yours",
        "Multiple users affected"
      ],
      "level": "High"
    },
    "multi_user_impact": true
  },
  "routing": {
    "standard_queue": "Engineering",
    "destination_queue": "Escalation"
  },
  "summary": "The customer reports that their dashboard stopped loading around 2pm EST, affecting multiple users. They have confirmed the issue is on the service provider's end.",
  "escalation": {
    "flagged": true,
    "reasons": [
      "multi_user_impact",
      "incident_category"
    ],
    "billing_discrepancy": null
  },
  "meta": {
    "model": "gpt-4o-mini-2024-07-18",
    "processed_at": "2026-10-16T12:32:52.923Z",
    "error": null
  }
}