{
  "id": "x01",
  "source": "Email",
  "received_at": "2026-10-16T12:57:40.118Z",
  "message": "Hi, it's not working again. Can you check?",
  "classification": {
    "rationale": "The message states that something is not working but does not specify what or indicate urgency.",
    "category": "Bug Report",
    "priority": "Low",
    "confidence": 0.7
  },
  "enrichment": {
    "core_issue": "The customer reports that something is not working again.",
    "identifiers": [],
    "billing": {
      "invoiced_amount": null,
      "contract_amount": null,
      "currency": null
    },
    "urgency": {
      "evidence": [],
      "level": "Low"
    },
    "multi_user_impact": false,
    "actionable": false
  },
  "routing": {
    "standard_queue": "Engineering",
    "destination_queue": "Escalation"
  },
  "summary": "The customer reports that something is not working again but does not provide specific details. No identifiers or billing information are mentioned.",
  "escalation": {
    "flagged": true,
    "reasons": [
      "not_actionable"
    ],
    "billing_discrepancy": null
  },
  "meta": {
    "model": "gpt-4o-mini-2024-07-18",
    "processed_at": "2026-10-16T12:57:41.936Z",
    "error": null
  }
}