{
  "id": "x06",
  "source": "Web Form",
  "received_at": "2026-10-16T13:24:19.897Z",
  "message": "It would help all our users if dashboards could be shared through a read-only public link.",
  "classification": {
    "rationale": "The message asks for a capability the customer believes does not exist.",
    "category": "Feature Request",
    "priority": "Low",
    "confidence": 0.95
  },
  "enrichment": {
    "core_issue": "The customer requests the ability to share dashboards through a read-only public link.",
    "identifiers": [],
    "billing": {
      "invoiced_amount": null,
      "contract_amount": null,
      "currency": null
    },
    "urgency": {
      "evidence": [],
      "level": "Low"
    },
    "multi_user_impact": true,
    "actionable": true
  },
  "routing": {
    "standard_queue": "Product",
    "destination_queue": "Product"
  },
  "summary": "The customer requests a feature that allows dashboards to be shared via a read-only public link, which they believe would benefit all users.",
  "escalation": {
    "flagged": false,
    "reasons": [],
    "billing_discrepancy": null
  },
  "meta": {
    "model": "gpt-4o-mini-2024-07-18",
    "processed_at": "2026-10-16T13:24:21.712Z",
    "error": null
  }
}