{
  "id": 1,
  "source": "Email",
  "received_at": "2026-10-19T06:20:08.082Z",
  "message": "Hi, I tried logging in this morning and keep getting a 403 error. My account is arcvault.io/user/jsmith. This started after your update last Tuesday.",
  "classification": {
    "rationale": "The message describes a 403 error when logging in, indicating a potential bug after an update.",
    "category": "Bug Report",
    "priority": "High",
    "confidence": 0.95
  },
  "enrichment": {
    "core_issue": "The customer is experiencing a 403 error when trying to log in.",
    "identifiers": [
      {
        "type": "account",
        "value": "arcvault.io/user/jsmith"
      },
      {
        "type": "error_code",
        "value": "403"
      }
    ],
    "billing": {
      "invoiced_amount": null,
      "contract_amount": null,
      "currency": null
    },
    "urgency": {
      "evidence": [
        "keep getting a 403 error",
        "This started after your update last Tuesday"
      ],
      "level": "High"
    },
    "multi_user_impact": false,
    "actionable": true
  },
  "routing": {
    "standard_queue": "Engineering",
    "destination_queue": "Engineering"
  },
  "summary": "The customer reports receiving a 403 error when attempting to log in to their account at arcvault.io/user/jsmith. This issue began after a recent update last Tuesday, indicating a potential bug that needs addressing.",
  "escalation": {
    "flagged": false,
    "reasons": [],
    "billing_discrepancy": null
  },
  "meta": {
    "model": "gpt-4o-mini-2024-07-18",
    "processed_at": "2026-10-19T06:20:10.321Z",
    "error": null
  }
}